[
  {
    "familyId": "miscrit:1",
    "variant": "base",
    "classificationMethod": "canonical-name-prefix-snapshot",
    "note": "UI category only, not evolution or shared family identity"
  },
  {
    "familyId": "miscrit:2",
    "variant": "base",
    "classificationMethod": "canonical-name-prefix-snapshot",
    "note": "UI category only, not evolution or shared family identity"
  },
  {
    "familyId": "miscrit:3",
    "variant": "base",
    "classificationMethod": "canonical-name-prefix-snapshot",
    "note": "UI category only, not evolution or shared family identity"
  },
  {
    "familyId": "miscrit:4",
    "variant": "base",
    "classificationMethod": "canonical-name-prefix-snapshot",
    "note": "UI category only, not evolution or shared family identity"
  },
  {
    "familyId": "miscrit:5",
    "variant": "base",
    "classificationMethod": "canonical-name-prefix-snapshot",
    "note": "UI category only, not evolution or shared family identity"
  },
  {
    "familyId": "miscrit:6",
    "variant": "base",
    "classificationMethod": "canonical-name-prefix-snapshot",
    "note": "UI category only, not evolution or shared family identity"
  },
  {
    "familyId": "miscrit:7",
    "variant": "base",
    "classificationMethod": "canonical-name-prefix-snapshot",
    "note": "UI category only, not evolution or shared family identity"
  },
  {
    "familyId": "miscrit:8",
    "variant": "base",
    "classificationMethod": "canonical-name-prefix-snapshot",
    "note": "UI category only, not evolution or shared family identity"
  },
  {
    "familyId": "miscrit:9",
    "variant": "base",
    "classificationMethod": "canonical-name-prefix-snapshot",
    "note": "UI category only, not evolution or shared family identity"
  },
  {
    "familyId": "miscrit:10",
    "variant": "base",
    "classificationMethod": "canonical-name-prefix-snapshot",
    "note": "UI category only, not evolution or shared family identity"
  },
  {
    "familyId": "miscrit:11",
    "variant": "base",
    "classificationMethod": "canonical-name-prefix-snapshot",
    "note": "UI category only, not evolution or shared family identity"
  },
  {
    "familyId": "miscrit:12",
    "variant": "base",
    "classificationMethod": "canonical-name-prefix-snapshot",
    "note": "UI category only, not evolution or shared family identity"
  },
  {
    "familyId": "miscrit:13",
    "variant": "base",
    "classificationMethod": "canonical-name-prefix-snapshot",
    "note": "UI category only, not evolution or shared family identity"
  },
  {
    "familyId": "miscrit:14",
    "variant": "base",
    "classificationMethod": "canonical-name-prefix-snapshot",
    "note": "UI category only, not evolution or shared family identity"
  },
  {
    "familyId": "miscrit:15",
    "variant": "base",
    "classificationMethod": "canonical-name-prefix-snapshot",
    "note": "UI category only, not evolution or shared family identity"
  },
  {
    "familyId": "miscrit:16",
    "variant": "base",
    "classificationMethod": "canonical-name-prefix-snapshot",
    "note": "UI category only, not evolution or shared family identity"
  },
  {
    "familyId": "miscrit:17",
    "variant": "base",
    "classificationMethod": "canonical-name-prefix-snapshot",
    "note": "UI category only, not evolution or shared family identity"
  },
  {
    "familyId": "miscrit:18",
    "variant": "base",
    "classificationMethod": "canonical-name-prefix-snapshot",
    "note": "UI category only, not evolution or shared family identity"
  },
  {
    "familyId": "miscrit:19",
    "variant": "base",
    "classificationMethod": "canonical-name-prefix-snapshot",
    "note": "UI category only, not evolution or shared family identity"
  },
  {
    "familyId": "miscrit:20",
    "variant": "base",
    "classificationMethod": "canonical-name-prefix-snapshot",
    "note": "UI category only, not evolution or shared family identity"
  },
  {
    "familyId": "miscrit:21",
    "variant": "base",
    "classificationMethod": "canonical-name-prefix-snapshot",
    "note": "UI category only, not evolution or shared family identity"
  },
  {
    "familyId": "miscrit:22",
    "variant": "base",
    "classificationMethod": "canonical-name-prefix-snapshot",
    "note": "UI category only, not evolution or shared family identity"
  },
  {
    "familyId": "miscrit:23",
    "variant": "dark",
    "classificationMethod": "canonical-name-prefix-snapshot",
    "note": "UI category only, not evolution or shared family identity"
  },
  {
    "familyId": "miscrit:24",
    "variant": "dark",
    "classificationMethod": "canonical-name-prefix-snapshot",
    "note": "UI category only, not evolution or shared family identity"
  },
  {
    "familyId": "miscrit:25",
    "variant": "dark",
    "classificationMethod": "canonical-name-prefix-snapshot",
    "note": "UI category only, not evolution or shared family identity"
  },
  {
    "familyId": "miscrit:26",
    "variant": "base",
    "classificationMethod": "canonical-name-prefix-snapshot",
    "note": "UI category only, not evolution or shared family identity"
  },
  {
    "familyId": "miscrit:27",
    "variant": "base",
    "classificationMethod": "canonical-name-prefix-snapshot",
    "note": "UI category only, not evolution or shared family identity"
  },
  {
    "familyId": "miscrit:28",
    "variant": "base",
    "classificationMethod": "canonical-name-prefix-snapshot",
    "note": "UI category only, not evolution or shared family identity"
  },
  {
    "familyId": "miscrit:29",
    "variant": "base",
    "classificationMethod": "canonical-name-prefix-snapshot",
    "note": "UI category only, not evolution or shared family identity"
  },
  {
    "familyId": "miscrit:30",
    "variant": "base",
    "classificationMethod": "canonical-name-prefix-snapshot",
    "note": "UI category only, not evolution or shared family identity"
  },
  {
    "familyId": "miscrit:31",
    "variant": "base",
    "classificationMethod": "canonical-name-prefix-snapshot",
    "note": "UI category only, not evolution or shared family identity"
  },
  {
    "familyId": "miscrit:32",
    "variant": "base",
    "classificationMethod": "canonical-name-prefix-snapshot",
    "note": "UI category only, not evolution or shared family identity"
  },
  {
    "familyId": "miscrit:33",
    "variant": "base",
    "classificationMethod": "canonical-name-prefix-snapshot",
    "note": "UI category only, not evolution or shared family identity"
  },
  {
    "familyId": "miscrit:34",
    "variant": "base",
    "classificationMethod": "canonical-name-prefix-snapshot",
    "note": "UI category only, not evolution or shared family identity"
  },
  {
    "familyId": "miscrit:35",
    "variant": "base",
    "classificationMethod": "canonical-name-prefix-snapshot",
    "note": "UI category only, not evolution or shared family identity"
  },
  {
    "familyId": "miscrit:36",
    "variant": "base",
    "classificationMethod": "canonical-name-prefix-snapshot",
    "note": "UI category only, not evolution or shared family identity"
  },
  {
    "familyId": "miscrit:37",
    "variant": "base",
    "classificationMethod": "canonical-name-prefix-snapshot",
    "note": "UI category only, not evolution or shared family identity"
  },
  {
    "familyId": "miscrit:38",
    "variant": "base",
    "classificationMethod": "canonical-name-prefix-snapshot",
    "note": "UI category only, not evolution or shared family identity"
  },
  {
    "familyId": "miscrit:39",
    "variant": "base",
    "classificationMethod": "canonical-name-prefix-snapshot",
    "note": "UI category only, not evolution or shared family identity"
  },
  {
    "familyId": "miscrit:40",
    "variant": "base",
    "classificationMethod": "canonical-name-prefix-snapshot",
    "note": "UI category only, not evolution or shared family identity"
  },
  {
    "familyId": "miscrit:41",
    "variant": "base",
    "classificationMethod": "canonical-name-prefix-snapshot",
    "note": "UI category only, not evolution or shared family identity"
  },
  {
    "familyId": "miscrit:42",
    "variant": "base",
    "classificationMethod": "canonical-name-prefix-snapshot",
    "note": "UI category only, not evolution or shared family identity"
  },
  {
    "familyId": "miscrit:43",
    "variant": "base",
    "classificationMethod": "canonical-name-prefix-snapshot",
    "note": "UI category only, not evolution or shared family identity"
  },
  {
    "familyId": "miscrit:44",
    "variant": "base",
    "classificationMethod": "canonical-name-prefix-snapshot",
    "note": "UI category only, not evolution or shared family identity"
  },
  {
    "familyId": "miscrit:45",
    "variant": "base",
    "classificationMethod": "canonical-name-prefix-snapshot",
    "note": "UI category only, not evolution or shared family identity"
  },
  {
    "familyId": "miscrit:46",
    "variant": "base",
    "classificationMethod": "canonical-name-prefix-snapshot",
    "note": "UI category only, not evolution or shared family identity"
  },
  {
    "familyId": "miscrit:47",
    "variant": "base",
    "classificationMethod": "canonical-name-prefix-snapshot",
    "note": "UI category only, not evolution or shared family identity"
  },
  {
    "familyId": "miscrit:48",
    "variant": "base",
    "classificationMethod": "canonical-name-prefix-snapshot",
    "note": "UI category only, not evolution or shared family identity"
  },
  {
    "familyId": "miscrit:49",
    "variant": "base",
    "classificationMethod": "canonical-name-prefix-snapshot",
    "note": "UI category only, not evolution or shared family identity"
  },
  {
    "familyId": "miscrit:50",
    "variant": "base",
    "classificationMethod": "canonical-name-prefix-snapshot",
    "note": "UI category only, not evolution or shared family identity"
  },
  {
    "familyId": "miscrit:51",
    "variant": "base",
    "classificationMethod": "canonical-name-prefix-snapshot",
    "note": "UI category only, not evolution or shared family identity"
  },
  {